{
  "schemaVersion": 1,
  "updatedAt": "2026-10-11",
  "campaign": "lemon-pepper-and-first-image-fallback-test-2026-10-11",
  "title": "Redgrass Tackle — Top 10",
  "optionIds": [
    480354642,
    480356730,
    480356703,
    480358674,
    480359310,
    480359541,
    480359382,
    480358887,
    480359577,
    480359430
  ],
  "fallbackImage": "assets/images/logo-redgrass.png",
  "testMissingImageSlot": 1
}
